https://esac-initiative.org/about/transformative-agreements/agreement-registry/wiley2023cdl/,Wiley,wiley2023cdl,,No,,01/01/2023,12/31/2023,California Digital Library (University of California),United States,2500,,Agreement costs within the range of the previous spending level,Total fee based on previous year subscription fees and a portion of the APC fees paid by authors from participating campuses,Subscriptions partly converted to OA publishing fees,"No practical fixed OA publishing entitlements. Instead, the total cost, including library support for OA publishing, and author contributions from grants where available, is set at a level based in part on the previous year’s total spend, including a limited portion of previous APC spend. This spend can fluctuate somewhat in response to author behavior within the agreement, but with the range of our reasonable expected outcomes, this fluctuation would not cause the library to need to pay more than in previous agreements.",Yes,Yes,"CC-BY preference, exceptions allowed","Original research articles, Review articles",20%-50%,This agreement generally transitions the bulk of UC’s spend with Wiley towards supporting open access. The actual percentage which continues to support access to content is dependent on how many authors opt out of the open access option.,Yes,Yes,Deficient,"Author workflow for the multipayer model, by which authors are asked to contribute grant funds to pay a portion of an APC if they have those funds available (but where the library redirects subscription funds to cover those APCs if authors do not have those funds available), has improved from the previous agreement year, but continues to include steps which may require the author to pause their post-acceptance processing (general publication processes continue behind the scenes and this rarely, if ever, delays publication of an article). More desirable would be a seamless workflow where the author sees the author to contribute under the multipayer model or not, chooses their preference, and moves along.","
"
https://esac-initiative.org/about/transformative-agreements/agreement-registry/wiley2024carli/,Wiley,wiley2024carli,,No,,01/01/2024,12/31/2029,CARLI (Consortium of Academic and Research Libraries in Illinois),United States,40,Covers 10 institutions,Agreement costs within the range of the previous spending level,,Subscriptions fully converted to OA publishing fees (access related costs 5% or less),,Yes,Yes,CC-BY mandatory,"Original research articles, Review articles",More than 50%,,Yes,Yes,Too early to assess,,
https://esac-initiative.org/about/transformative-agreements/agreement-registry/wiley2023btaa/,Wiley,wiley2023btaa,Wiley Read & Publish,No,,01/01/2023,12/31/2025,Big Ten Academic Alliance,United States,4200,,Agreement costs within the range of the previous spending level,"Inflation caps are low to keep fees down for individual institutions, but a modest central payment is made by the consortium",Subscriptions partly converted to OA publishing fees,,Yes,Yes,CC-BY variations allowed,Original research articles,More than 50%,,Yes,Yes,Ok,Articles are approved automatically via email addresses/domains with minimal work required by library staff,This is a significant agreement that includes 14 of the largest research institutions in the United State as well as another 20 affiliated campuses. It is hoped that costs can be reduced in future agreements. Long term success will depend upon other institutions joining open publishing agreements and supporting the model.
https://esac-initiative.org/about/transformative-agreements/agreement-registry/wiley2022cdl/,Wiley,wiley2022cdl,,Yes,https://ucsf.app.box.com/s/om3ubawi6ctw008mjkxwz95eno3avga2,01/01/2022,12/31/2022,California Digital Library (University of California),United States,2500,"This includes articles across the UC system, however, the publishing portion of this pilot only covered the five smallest campuses (UC Irvine, UC Merced, UC Riverside, UC Santa Barbara, and UC Santa Cruz), responsible for approximately 600 articles published",Agreement costs within the range of the previous spending level,Total fee based on previous year subscription fees and APC fees paid by authors from participating campuses,Subscriptions partly converted to OA publishing fees,"No practical fixed OA publishing entitlements. Instead, the total cost, including library support for OA publishing, and author contributions from grants where available, is fixed at a level equivalent to the previous year’s total spend, ensuring that there are no fluctuations in cost in this year.",Yes,Yes,"CC-BY preference, exceptions allowed","Original research articles, Review articles",More than 50%,"This agreement is still largely a subscription agreement for the five largest UC campuses, and so the majority of the money exchanged is to secure ongoing access to content for those campuses",Yes,Yes,Deficient,"Author workflow as implemented, particularly for the multipayer model by which authors are asked to contribute grant funds to pay a portion of an APC if they have those funds available (but where the library redirects subscription funds to cover those APCs if authors do not have those funds available), is not as seamless for our authors with Wiley as it is in other agreements; our uptake rate has likely suffered as a result. Authors under this agreement need to have a brief interaction with Wiley’s customer service to indicate that they do not have grant funds available and need the library to cover the full cost.","This agreement is a first step on the pathway to a fuller agreement between UC and Wiley, potentially also in collaboration with the Statewide California Electronic Library Consortium (SCELC). Through this one-year stepping-stone agreement, Wiley can begin to ramp up its ability to support the multipayer model, described below, and make content at the five smaller UC campuses openly available, while maintaining a subscription model for the five larger UC campuses in the meantime. Assessment of this agreement, concurrent with negotiations for next year’s agreement, will help iterate on and improve the workflow implementation as we move to a wider agreement.
"
https://esac-initiative.org/about/transformative-agreements/agreement-registry/wiley2022btaa/,Wiley,wiley2022btaa,Wiley Read & Publish,No,,02/01/2022,12/31/2022,Big Ten Academic Alliance,United States,4200,,Agreement costs within the range of the previous spending level,Costs are slightly more to cover the OA publishing fees,Subscriptions partly converted to OA publishing fees,,Yes,No,CC-BY variations allowed,"Original research articles, Review articles",More than 50%,,Yes,Yes,Ok,,The pilot agreement will not cover 100% of the hybrid article output of the consortium
https://esac-initiative.org/about/transformative-agreements/agreement-registry/degruy2023osu/,Walter de Gruyter,degruy2023osu,De Gruyter Read and Publish Agreement,No,,01/01/2023,12/31/2025,The Ohio State University,United States,10,,Cost increase,,Subscriptions partly converted to OA publishing fees,Uncapped Open Access publishing,Yes,Yes,CC-BY mandatory,"Original research articles, Review articles, Proceedings",More than 50%,,Yes,Yes,Too early to assess,,
https://esac-initiative.org/about/transformative-agreements/agreement-registry/trs2023osu/,The Royal Society,trs2023osu,Royal Society Read & Publish Agreement,No,,01/01/2023,12/31/2023,The Ohio State University,United States,15,,Cost increase,,Cost based on discounted 2023 subscription renewal price plus the average annual APC spend over two years (2020 and 2021),Uncapped Open Access publishing,Yes,Yes,CC-BY mandatory,"Original research articles, Review articles, Proceedings, Letters, Editorials",More than 50%,,Yes,Yes,Ok,,
https://esac-initiative.org/about/transformative-agreements/agreement-registry/degruy2019iowa/,Walter de Gruyter Inc.,degruy2019iowa,Read and Publish,No,,01/01/2019,12/31/2021,Iowa State University,United States,15,,Cost increase,"We are paying approximately 25% more than we were paying for a small journal package and individual subscriptions. The new agreement will cover up to 21 OA articles, and we are getting read access to approximately 150 additional titles.",Transformative mechanism rests on Read fee diminishing over time as subscription articles go down and open access articles go up. This is dependent on library uptake of the R and P model.,"Approximately 50% more articles can be published OA under the agreement than were published n 2018. If publishing exceeds this number, articles will either be published on the subscription side or the library will need to pay more.",Yes,No,CC-BY mandatory,Original research articles,1%-5%,,Few articles are published with this publisher.,Yes,Too early to assess,,This is a workable agreement for that will be evaluated going forward. Publisher was very easy to work with and very responsive.
https://esac-initiative.org/about/transformative-agreements/agreement-registry/trs2021osu/,The Royal Society,trs2021osu,Royal Society Read & Publish Agreement,No,,01/01/2021,12/31/2021,The Ohio State University,United States,15,,Cost increase,,Costs are based on 2021 subscription spend plus the average annual APC spend over two years (2018 + 2019),"Uncapped, unlimited Open Access publishing",Yes,Yes,CC-BY mandatory,"Original research articles, Review articles, Proceedings, Letters, Editorials",More than 50%,,Yes,Yes,Too early to assess,,Pilot agreement
https://esac-initiative.org/about/transformative-agreements/agreement-registry/trs2022osu/,The Royal Society,trs2022osu,Royal Society Read & Publish Agreement,No,,01/01/2022,12/31/2022,The Ohio State University,United States,15,,Cost increase,,Cost based on stabilized 2022 subscription renewal price plus the average annual APC spend over two years (2019 and 2020),"Uncapped, unlimited Open Access publishing",Yes,Yes,CC-BY mandatory,"Original research articles, Review articles, Proceedings, Letters, Editorials",More than 50%,,Yes,Yes,Ok,,
https://esac-initiative.org/about/transformative-agreements/agreement-registry/trs2023msu/,The Royal Society,trs2023msu,The Royal Society Publishing Read and Publish Agreement,No,,01/01/2023,12/31/2023,Montana State University,United States,80,Uncapped OA publishing,Agreement costs within the range of the previous spending level,,Subscriptions partly converted to OA publishing fees,Not applicable. Uncapped OA publishing.,Yes,Yes,CC-BY mandatory,Original research articles,More than 50%,,Yes,Yes,Ok,The Royal Society will provide MSU quarterly reports of the total number of articles published in conformity with the agreement,"Yes, this is sustainable with regards to costs and operations"
https://esac-initiative.org/about/transformative-agreements/agreement-registry/trs2023lyrasis/,The Royal Society,trs2023lyrasis,Lyrasis – The Royal Society Transformative Agreement,No,,01/01/2023,12/31/2023,Lyrasis,United States,20,Unlimited OA publishing allowed for all participating institutions,Cost decrease,,Subscriptions partly converted to OA publishing fees,The publishing fees are fixed for the duration of the agreement. There are no added fees for the number of articles published over the historical average during the paid for years. Unlimited OA publication output is included.,Yes,Yes,CC-BY mandatory,"Original research articles, Review articles, Proceedings, Letters, Editorials",More than 50%,,Yes,Yes,Ok,,This cost-effective agreement covers unlimited OA publishing and read access to the publisher’s full journal package as a gradual transition to moving towards full OA. Their dedication to cost savings made a switch to a transformative agreement an easy decision for member libraries. The publisher seems to have a smooth workflow in place for corresponding authors that are covered by the agreement.
https://esac-initiative.org/about/transformative-agreements/agreement-registry/trs2021cdl/,The Royal Society,trs2021cdl,Royal Society transformative agreement,No,https://ucsf.box.com/s/agjy5l68ucp2b7456q59he3nsxm3zhr3,01/01/2021,12/31/2023,California Digital Library (University of California),United States,15,,Cost decrease,Cost is based on prior UC system-wide expenditure (including prior APC spend by authors from UC campuses as well as library expenditures) and is then reduced due to withdrawal of one campus from the UC agreement. The agreement includes mechanisms to control costs throughout the term of the agreement.,Subscriptions fully converted to OA publishing fees (access related costs 5% or less),"The agreement features the following risk-control mechanism: There is a minimum and maximum set for the total fees that will be billed to UC in each year of the agreement. In addition, APC rates are held flat for the duration of the agreement.",Yes,Yes,CC-BY mandatory,"Original research articles, Review articles",0%,Agreement is structured to include access as well as publishing but the finances are structured without any access fee,Yes,Yes,Too early to assess,"The agreement is implemented using the multi-payer model, which provides a mechanism to combine funding from the libraries with authors’ grant funds, if the author so chooses. More details appear below in the Overall Assessment and Comments section.","This agreement is an important step in the overall transition, particularly for not-for-profit and society publishers.
"
https://esac-initiative.org/about/transformative-agreements/agreement-registry/tf2023osu/,Taylor & Francis,tf2023osu,Taylor & Francis Read and Publish Agreement,No,,01/01/2023,12/31/2025,The Ohio State University,United States,230,,Cost increase,,Subscriptions partly converted to OA publishing fees,Fixed open access publishing entitlements correlate to the anticipated article output,Yes,Yes,CC-BY variations allowed,"Original research articles, Review articles, Proceedings",More than 50%,Access related costs are roughly 50% of the overall agreement,Yes,Yes,Too early to assess,This is a new three-year agreement following a three-year pilot agreement. Communication between Taylor & Francis and The Ohio State University Libraries has been excellent. Taylor & Francis is currently implementing improvements to the open access author services workflow.,
https://esac-initiative.org/about/transformative-agreements/agreement-registry/iop2023lyrasis/,IOP Publishing,iop2023lyrasis,Read and Publish Agreement,No,,01/01/2023,12/31/2025,Lyrasis,United States,28,Unlimited OA publishing allowed for all participating institutions,Agreement costs within the range of the previous spending level,Minor subscription rate increases in order to facilitate uncapped publishing according to the new IOP model,Subscriptions partly converted to OA publishing fees,N/A. Unlimited OA publishing allowed for all participating institutions.,Yes,Yes,CC-BY mandatory,"Original research articles, Review articles, Proceedings, Letters, Editorials",More than 50%,,Yes,Yes,Too early to assess,,"This deal felt like a natural fit for OA transition for the small and medium sized institutions within the existing group. No tracking was required on the part of the members, they simply had to agree to the pricing and terms and conditions and their authors would be eligible for OA publication."
https://esac-initiative.org/about/transformative-agreements/agreement-registry/iop2023iowa/,IOP Publishing,iop2023iowa,2023-2025 Iowa State University Institute of Physics OA agreement,Yes,https://dr.lib.iastate.edu/entities/publication/4ff1491f-83a2-4835-b47b-80a0d8da6e2a,01/01/2023,12/31/2025,Iowa State University,United States,10,,Agreement costs within the range of the previous spending level,,Subscriptions partly converted to OA publishing fees,Unlimited publishing under the agreement,Yes,Yes,CC-BY variations allowed,"Original research articles, Review articles, Letters",More than 50%,,Yes,Yes,Ok,,
https://esac-initiative.org/about/transformative-agreements/agreement-registry/ieee2022cdl/,IEEE,ieee2022cdl,,Yes,https://ucsf.app.box.com/s/oyozsjnj6djhhk6ddd5sirqow4s86kjq,07/15/2022,12/31/2025,California Digital Library (University of California),United States,570,"This count includes only journal articles; UC also publishes over 1,000 conference proceeding papers with IEEE each year",Agreement costs within the range of the previous spending level,"No prescribed cost increase for the library, however, underperformance in key aspects of the agreement relating to author grant participation could result in additional fees to the library (the library may choose not to pay all of these additional fees and end the OA portion of the agreement). Cost increases could occur from the perspective of all funds coming from the institutions based on the level of author contributions from grant funds.",Subscriptions partly converted to OA publishing fees,"No fixed entitlements: all journal articles published are eligible. There are aggregate spend thresholds which need to be reached via authors that are able to contribute to publishing fees from grant funds under the multipayer model. If those thresholds are not met then the libraries may need to pay an additional fee to reach those thresholds, while if top-end thresholds are exceeded then the libraries receive a corresponding credit to their up-front spend the following year.",Yes,Yes,CC-BY variations allowed,"Original research articles, Review articles, Proceedings",More than 50%,"This includes continued access costs for conference proceedings, standards, and other content types which are not covered for OA publication by this agreement",Yes,Yes,Too early to assess,IEEE uses CCC RightsLink for payment workflow,"UC’s agreement with IEEE is a step on the pathway towards transitioning computer science and electrical engineering content to open access. However, IEEE has a substantive portfolio of conference proceedings and other publication types which are not included in this agreement, which will hopefully be considered in future iterations on this contract.
"
https://esac-initiative.org/about/transformative-agreements/agreement-registry/iop2023btaa/,IOP Publishing,iop2023btaa,Read and Publish License,No,,01/01/2023,12/31/2025,Big Ten Academic Alliance,United States,375,15 Libraries,Agreement costs within the range of the previous spending level,Small inflation cap increase to facilitate uncapped publishing,Subscriptions partly converted to OA publishing fees,N/A. Unlimited OA publishing for all institutions.,Yes,Yes,CC-BY mandatory,"Original research articles, Review articles, Proceedings, Letters, Editorials",More than 50%,,Yes,Yes,Too early to assess,,This is agreement is close to cost neutral with no added labor required from library staff
https://esac-initiative.org/about/transformative-agreements/agreement-registry/gsl2022jisc/,The Geological Society of London,gsl2022jisc,Geological Society Lyell Collection Read and Publish 2022-2023,Yes,https://repository.jisc.ac.uk/8632/1/Lyell_Collection_licence_2022_2023.docx,01/01/2022,12/31/2023,Jisc,United Kingdom,94,Average output 2018-2020,Agreement costs within the range of the previous spending level,,Subscriptions partly converted to OA publishing fees,OA publishing is unlimited,Yes,No,CC-BY mandatory,"Original research articles, Review articles, Proceedings",More than 50%,,Yes,Partly (e.g. to core journals only),Too early to assess,The practical implementation of the agreement will be assessed by Jisc throughout its term,The agreement offers unlimited read access to the full Lyell Collection and unlimited open access publishing in the hybrid journals and book series in the collection.
https://esac-initiative.org/about/transformative-agreements/agreement-registry/sn2023jisc/,Springer Nature,sn2023jisc,Springer Nature Read and Publish Agreement 2023-2025,Yes,https://repository.jisc.ac.uk/9176/1/SN_TA.pdf,01/01/2023,12/31/2025,Jisc,United Kingdom,5800,Unlimited open access publishing is included for Springer journals but a cap is applied for Nature Research journals. The cap is 401 articles in year one but this is subject to change as more members join or add additional titles. The figure above does not include publications in fully open access journals.,Cost decrease,,Subscriptions partly converted to OA publishing fees,"Should the cap in Nature Research journals be exceeded, manuscripts can be shared immediately on publication via CC-BY license",No,No,"CC-BY preference, exceptions allowed","Original research articles, Review articles",20%-50%,,Yes,Partly (e.g. to core journals only),Too early to assess,The practical implementation of the agreement will be assessed by Jisc throughout its term,"The agreement results in real term cost savings for institutions and provides open access publishing in Nature Research titles for the first time. However, UK institutions expressed reservations about the agreement overall, particularly around the lack of transparency on costs in Nature Research journals."
https://esac-initiative.org/about/transformative-agreements/agreement-registry/gsl2021jisc/,The Geological Society of London,gsl2021jisc,Geological Society Lyell Collection Read & Publish Agreement 2021,Yes,https://repository.jisc.ac.uk/8078/1/Jisc%20Collections%20Geological%20Society%20Lyell%20Collection%20contract%20for%20publication%20%281%29.docx,01/01/2021,12/31/2021,Jisc,United Kingdom,80,Approximate output based on 2018/19 numbers,Agreement costs within the range of the previous spending level,,Subscriptions partly converted to OA publishing fees,Open access published output is unlimited and this is expected to increase as previously paywalled articles are converted to OA.,Yes,No,"CC-BY preference, exceptions allowed","Original research articles, Review articles, Proceedings",More than 50%,Read access to key book series and historic collections as well as Read & Publish in hybrid journals and books,Yes,Partly (e.g. to core journals only),Too early to assess,,The agreement offers read access to the full Lyell Collection and unlimited open access publishing for corresponding authors at participating institutions in the hybrid journals and book series in the collection.
https://esac-initiative.org/about/transformative-agreements/agreement-registry/tf2021jisc/,Taylor & Francis,tf2021jisc,Taylor & Francis Read and Publish agreement 2021-23,Yes,https://repository.jisc.ac.uk/8363/1/Informa_UK_Ltd_TF_Read_and_Publish_ESAC.docx,01/01/2021,12/31/2023,Jisc,United Kingdom,5800,The article allocation in Year 1 (2021) covers 100% of publishing output from 2019,Agreement costs within the range of the previous spending level,"The agreement is costed using subscription spend only, with no publishing spend factored in. It is based on a 0% fee increase on the previous year’s (2020) subscription spend.",Subscriptions partly converted to OA publishing fees,A 20% discount is available for APCs accepted after the cap is reached,No,No,"CC-BY preference, exceptions allowed",Original research articles,More than 50%,,Yes,Partly (e.g. to core journals only),Ok,"T&F have an internally-developed Dashboard, which over a third of existing subscribers are already using","This agreement transitions a highly significant proportion of UK publishing output towards Open Access, and keeps that output within the boundaries of Read spend only."
https://esac-initiative.org/about/transformative-agreements/agreement-registry/sc2019jisc/,Springer Nature,sc2019jisc,Springer Compact,Yes,https://repository.jisc.ac.uk/8072/1/Jisc%20Collections%20Springer%20Compact%20Dec%202021%20FINAL%20ESAC.docx,01/01/2019,12/31/2022,Jisc Collections,United Kingdom,5000,,Cost increase,,Subscriptions fully converted to oa publishing fees (access related costs 5% or less),"Based on the modelling of current and projected publishing patterns, we believe the caps will cover all articles published by UK institutions. However, we will continue to monitor this closely on a month to month basis. If the total number of allotted articles is exhausted within the relevant period, institutions will either need to pay Springer additional APCs, or notify the publisher that they no longer wish to publish open access.",Yes,Yes,,"Original research articles, Review articles",0%,,Yes,Yes,Too early to assess,,–
https://esac-initiative.org/about/transformative-agreements/agreement-registry/sfn2024jisc/,Society for Neuroscience,sfn2024jisc,Society for Neuroscience Read & Publish Transitional Agreement 2024,Yes,https://repository.jisc.ac.uk/9367/1/SfN_licence_2024.pdf,01/01/2024,12/31/2024,Jisc,United Kingdom,106,2020-2021 UK output,Agreement costs within the range of the previous spending level,,Subscriptions partly converted to OA publishing fees,OA publishing is unlimited,No,No,CC-BY mandatory,"Original research articles, Review articles",More than 50%,,No,Yes,Ok,,Jisc and the publisher will assess the sustainability of this agreement during the agreement term
https://esac-initiative.org/about/transformative-agreements/agreement-registry/sage2023shedl/,SAGE,sage2023shedl,Sage Journals SHEDL Read and Publish 2023-24,Yes,https://repository.jisc.ac.uk/9166/1/Jisc_Collections_Sage_Journals_SHEDL_RP_2023_24.pdf,01/01/2023,12/31/2024,Jisc,United Kingdom,350,Uncapped read and publish agreement,Cost increase,Annual price increase applies,Subscriptions partly converted to OA publishing fees,N/A,No,No,CC-BY variations allowed,"Original research articles, Review articles, Case reports",20%-50%,,Yes,Yes,Ok,The practical implementation of the agreement will be assessed by Jisc throughout its term,"This agreement transitions a significant proportion of UK research publishing output towards open access, for an acceptable increase in previous subscription spend. The efficacy of the agreement will be reviewed by Jisc throughout its term."
