https://esac-initiative.org/about/transformative-agreements/agreement-registry/rsc2024slov/,Royal Society of Chemistry,rsc2024slov,,Yes,https://www.enarocanje.si/pregledPogodb/pogodba.asp?id=252974,01/01/2024,12/31/2024,Slovenian Consortium CTK,Slovenia,25,"The agreement actually offers an unlimited number of open access publications in RSC journals and its partner society hybrid journals, therefore fully covers the expected annual number of publications",Cost increase,"Cost increase in relation to previous subscription-only agreement, but estimated actually as cost-neutral in terms of “total cost of publication” in previous years",Subscriptions partly converted to OA publishing fees,"For fully gold journals a 15% APC discount has been agreed , therefore publication in gold journals will result in additional APC costs on top of the contract value",Yes,No,"CC-BY preference, exceptions allowed","Original research articles, Review articles, Letters, Editorials",20%-50%,,Yes,Yes,Ok,"Only administrators from individual consortium members can access the approval platform, there is no consortium level access, monitoring of article production is therefore more difficult, as is the assistance to authors and administrators",The costs of this agreement are estimated as acceptable to all consortium members as the license covers an unlimited number of vouchers for OA publications by corresponding authors from the consortium
https://esac-initiative.org/about/transformative-agreements/agreement-registry/compbio2022ub/,The Company of Biologists,compbio2022ub,Read and Publish Licence Agreement,Yes,https://crai.ub.edu/sites/default/files/recerca/Acords/compofbiologistsaddendumub.pdf,01/01/2022,31/12/2024,Universitat de Barcelona,Spain,5,,Agreement costs within the range of the previous spending level,,Subscriptions fully converted to OA publishing fees (access related costs 5% or less),,Yes,Yes,CC-BY mandatory,Original research articles,0%,,Yes,No,Too early to assess,,
https://esac-initiative.org/about/transformative-agreements/agreement-registry/compbio2021csic/,Company of Biologists,compbio2021csic,Read and Publish Licence Agreement,Yes,http://bibliotecas.csic.es/sites/default/files/OK%20-%20Company%20of%20Biologists%20CSIC%20OA%20Site%20Licence%20Addendum%20-%202021-2023.pdf,01/01/2021,12/31/2023,CSIC Spanish National Research Council,Spain,15,,Agreement costs within the range of the previous spending level,"Cost-neutral, based only on the prior CSIC’s subscription investment. Annual cost will not increase throughout the 3 years of the contract.",Subscriptions fully converted to OA publishing fees (access related costs 5% or less),,No,No,CC-BY mandatory,Original research articles,0%,Agreement is structured to include access as well as publishing but the finances are structured without any access fee,Yes,Yes,Too early to assess,,"With this agreement, CSIC-Spanish National Research Council is satisfied because it is a cost neutral agreement. In addition, it has been beneficial in extending the reading to the entire institution, whereas previously, the access was only for 15 subscriber institutes. The number of publishable OA articles is unlimited. The only reason for dissatisfaction is that the Gold OA journals are not included into the agreement."
https://esac-initiative.org/about/transformative-agreements/agreement-registry/cam2021ub/,Cambridge University Press,cam2021ub,Read and Publish,Yes,https://crai.ub.edu/sites/default/files/recerca/Acords/universitat_de_barcelona_cambridge_university_press_agreement.pdf,01/01/2021,31/12/2023,Universitat de Barcelona,Spain,50,,Agreement costs within the range of the previous spending level,,Subscriptions fully converted to OA publishing fees (access related costs 5% or less),,Yes,Yes,CC-BY variations allowed,"Original research articles, Review articles",More than 50%,,Yes,Yes,Too early to assess,,
https://esac-initiative.org/about/transformative-agreements/agreement-registry/cam2023csic/,Cambridge University Press,cam2023csic,Cambridge Journals Transformative Agreement,Yes,http://bibliotecas.csic.es/sites/default/files/ESAC-CSIC-CUP-2023-2025.pdf,01/01/2023,12/31/2025,CSIC Spanish National Research Council,Spain,40,,Agreement costs within the range of the previous spending level,It is our second transformative agreement with this publisher and there has been no increase in costs,Subscriptions partly converted to OA publishing fees,There is no limit for the numbers of articles covered (unlimited),Yes,Yes,CC-BY variations allowed,"Original research articles, Review articles",More than 50%,Reading fee for 2023 is 68% and publish fee 32%,Yes,Yes,Ok,"The author is identified by e-mail. CUP uses Rightslink. The author selects the institution to which he/she belongs. He/she is asked to publish OA or not. CUP reports are monthly, with DOIs and dates of acceptance and publication of the articles. There is no acknowledgment note for OA payment. Retroactive OA publishing also possible.",OA publishing is slowly growing with this publisher.
https://esac-initiative.org/about/transformative-agreements/agreement-registry/cam2021cisug/,Cambridge University Press,cam2021cisug,Cambridge Journals Online Read and Publish for consortia,No,,01/01/2021,12/31/2021,CISUG (Interuniversitary Consortium of the Galician University System),Spain,13,Average range of annual corresponding author publications 2017-2019,Agreement costs within the range of the previous spending level,,Unlimited publications included in the overall subscription fee,,Yes,Yes,CC-BY variations allowed,"Original research articles, Review articles, Rapid-Communication; Brief-Report; Case-Report",More than 50%,,Yes,Yes,Too early to assess,,
https://esac-initiative.org/about/transformative-agreements/agreement-registry/cam2020csic/,Cambridge University Press,cam2020csic,Cambridge Journals Read & Publish,No,,01/01/2020,12/31/2022,CSIC Spanish National Research Council,Spain,40,,Cost increase,,Subscriptions partly converted to OA publishing fees,,Yes,Yes,CC-BY variations allowed,"Original research articles, Review articles, Rapid communications",20%-50%,"Reading fee the first year (2020) is 10%, the reading fee for the last year of the contract (2022) is around 50%"," 
",Yes,Too early to assess,,
https://esac-initiative.org/about/transformative-agreements/agreement-registry/acs2021crue/,American Chemical Society,acs2021crue,CRUE-CSIC Alliance agreement ACS,No,https://www.crue.org/wp-content/uploads/2021/09/MoU-ACS.pdf,01/01/2021,12/31/2024,CRUE-CSIC Alliance,Spain,899,,Agreement costs within the range of the previous spending level,,Subscriptions partly converted to OA publishing fees,,Yes,Fully OA titles are included selectively,CC-BY mandatory,"Original research articles, Review articles",20%-50%,,Yes,Yes,Too early to assess,,
https://esac-initiative.org/about/transformative-agreements/agreement-registry/brill2023csic/,Brill,brill2023csic,Brill Transformative Agreement License,Yes,http://bibliotecas.csic.es/sites/default/files/ESAC-CSIC-Brill-Transformative-agreement-2023-2024.pdf,01/01/2023,12/31/2024,CSIC Spanish National Research Council,Spain,12,,Cost increase,,Subscriptions partly converted to OA publishing fees,Unlimited publishing. No risk sharing.,Yes,Yes,CC-BY mandatory,"Original research articles, Review articles",More than 50%,CSIC has access to a portfolio of 41 titles for 13 of its institutes. But any CSIC author may publish in any Brill journal,Yes,Partly (e.g. to core journals only),Too early to assess,,
https://esac-initiative.org/about/transformative-agreements/agreement-registry/aip2022csic/,AIP Publishing,aip2022csic,Content Licensing Agreement,Yes,http://bibliotecas.csic.es/sites/default/files/OK%20AIP-CSIC%202022-2024%20Licensing%20Agreement.pdf,01/01/2022,12/31/2024,CSIC Spanish National Research Council,Spain,26,Art. cap: 46,Agreement costs within the range of the previous spending level,,Subscriptions fully converted to OA publishing fees (access related costs 5% or less),,Yes,No,CC-BY mandatory,"Original research articles, Review articles, Proceedings",0%,The ratio between reading cost and publication cost is not specified. The number of OA articles provided for in the agreement is greater than those published annually by the institution. All subscription cost has been moved to OA publication.,Yes,Yes,Too early to assess,,
https://esac-initiative.org/about/transformative-agreements/agreement-registry/cam2022kesli/,Cambridge University Press,cam2022kesli,KESLI-Cambridge University Press Read and Publish Agreement,No,,01/01/2022,12/31/2024,KESLI,South Korea,10,Unlimited,Agreement costs within the range of the previous spending level,,Subscriptions partly converted to OA publishing fees,Unlimited publishing entitled to the eligible corresponding authors & retroactive OA publishing option available,No,Fully OA titles are included selectively,"CC-BY preference, exceptions allowed","Original research articles, Review articles, Rapid communication, brief report, case report",5%-20%,,No,Partly (e.g. to core journals only),Too early to assess,,"This is the first OA TA for KESLI Consortium in South Korea. Participating institutions have mostly positive opinions, specifically unlimited open access publishing and retroactive OA publishing. They also agree open access transition is the future of scholarly communications."
https://esac-initiative.org/about/transformative-agreements/agreement-registry/wiley2022nst/,Wiley,wiley2022nst,NST-Wiley Read and Publish Pilot Agreement,No,,01/01/2022,12/31/2024,National Research Council of Science & Technology,South Korea,170,Approximately 85% of total research output would be covered throughout the agreement period,Agreement costs within the range of the previous spending level,"All NST institutions, including those that previously subscribed to individual titles only or unsubscribed at all, extend access coverage to STM collection. The baseline value includes ancillary hybrid OA publishing cost in the previous year.",Subscriptions partly converted to OA publishing fees,OA allowance must be used by end of each calendar year. Allowance is split allocated per institution and unused allowances may be transferred within each calendar year between institutions.,No,No,"CC-BY preference, exceptions allowed","Original research articles, Review articles, Letters",20%-50%,,No,Partly (e.g. to core journals only),Too early to assess,,"This agreement covers just 25 government-funded research institutes under NST, whose research outcome takes up about 5% of Wiley articles in South Korea. Approximately 85% of total Wiley articles from NST will be open access for three years."
https://esac-initiative.org/about/transformative-agreements/agreement-registry/els2021nst/,Elsevier,els2021nst,NST-Elsevier Pilot Agreement,No,,01/01/2021,31/12/2023,National Research Council of Science & Technology,South Korea,400,,Agreement costs within the range of the previous spending level,"All NST institutions, including those that previously subscribed to only Subject collections or only individual titles, extend access coverage to freedom collection",Subscriptions partly converted to OA publishing fees,OA allowance must be used by end of each calendar year. Allowance is split allocated per institution and unused allowances may be transferred within each calendar year between institutions.,No,No,"CC-BY preference, exceptions allowed","Original research articles, Review articles",More than 50%,,No,Partly (e.g. to core journals only),Too early to assess,,"This agreement covers just 25 government-funded research institutes under NST, whose research outcome takes up about one fifteenth of South Korea. Approximately 40% of total Elsevier articles will be open access for three years. Despite the number of participating institutions is small, this agreement is the first transformative agreement made in South Korea and can be considered as an remarkable step towards the open access transformation."
https://esac-initiative.org/about/transformative-agreements/agreement-registry/wiley2022sanlic/,Wiley,wiley2022sanlic,Wiley Read and Publish Agreement,No,,01/01/2022,12/31/2025,SANLiC,South Africa,671,Average of the number of articles by corresponding authors published between 2014 and 2021,Agreement costs within the range of the previous spending level,"Given the inclusion of free Gold OA publishing in Wiley Gold OA and Hindawi journals in years 2-4, plus the ability to publish almost all articles OA without expenditure beyond previous subscription-only agreements, this is tantamount to achieving optimal OA publishing by repurposing existing subscription expenditure and avoiding additional, substantial publishing expenditure",Subscriptions fully converted to OA publishing fees (access related costs 5% or less),"OA allowance projected to cover all article output (20% more than previous output). If article output is exceeded in any one year, the institution may choose to cover APCs for additional articles at a 15% discount.",Yes,Yes,CC-BY variations allowed,"Original research articles, Review articles, Case studies, Commentaries, Data articles, Lectures, Methods & protocols, Perspectives, Practice & policy, Technical notes.",More than 50%,,Yes,Yes,Too early to assess,Mechanisms are in place that create the expectation for a positive workflow experience,Very positive. Authors are able to publish OA in all but a handful of fully closed journals without author-facing charges. This has been achieved through the repurposing of subscription funds; nothing more is being paid for hybrid OA. Gold OA is at no charge for years 2-4 of the agreement and includes Hindawi journals. We have also achieved some social justice aims in the form of additional author support.
https://esac-initiative.org/about/transformative-agreements/agreement-registry/trs2021sanlic/,The Royal Society,trs2021sanlic,Royal Society Read & Publish agreement,No,,01/01/2021,12/31/2021,SANLiC,South Africa,20,Average article output 2018-2020,Cost increase,,Costs are based on subscription spend plus the cost of one APC. This is a single year agreement.,Uncapped OA publishing,Yes,Yes,CC-BY mandatory,"Original research articles, Review articles, Proceedings, Letters, Editorials",More than 50%,,Yes,Yes,Too early to assess,,
https://esac-initiative.org/about/transformative-agreements/agreement-registry/sn2023sanlic/,Springer Nature,sn2023sanlic,Springer Transformative Agreement,No,,01/01/2023,12/31/2025,SANLiC,South Africa,1040,Average articles published behind the paywall in hybrid journals over 4 years (2018-2022),Agreement costs within the range of the previous spending level,The Nature Research journals have been excluded from the agreement. A separate read-only agreement has been signed for these titles.,Subscriptions partly converted to OA publishing fees,"We believe that the article entitlement cap will cover all articles published by SANLiC members but this will be closely monitored. The cap has a 10% extra entitlement (a “corridor”). If the cap, including the “corridor”, is exceeded in a calendar year, the consortium may, if it wishes, add additional funds to increase the entitlement.",Yes,No,"CC-BY preference, exceptions allowed","Original research articles, Review articles, Brief communications, Continuing Education",5%-20%,,Yes,Yes,Too early to assess,,This agreement will increase South Africa’s contribution to the overall open access transition. It will be closely monitored to assess its sustainability and to see what adjustments would have to be made in future.
https://esac-initiative.org/about/transformative-agreements/agreement-registry/iop2023sanlic/,IOP Publishing,iop2023sanlic,IOP Publishing Read & Publish Agreement,No,,01/01/2023,12/31/2025,SANLiC,South Africa,37,"Average of three years, provided by the IOP",Agreement costs within the range of the previous spending level,Average increase on previous spend of 2.26% over the three years of the agreement,Subscriptions fully converted to OA publishing fees (access related costs 5% or less),This is an uncapped agreement with minimal risk,Yes,Yes,CC-BY variations allowed,"Original research articles, Review articles, Letters",20%-50%,The share of publishing costs vs access costs is not expressed in the agreement,Yes,Yes,Too early to assess,,The offer is for unlimited OA publishing in hybrid and fully OA journals with the repurposing of the subscription fees. Given the saving of full OA publishing alone (based on trend) the “increase” on the 2022 subscription fee is effectively 0%.
https://esac-initiative.org/about/transformative-agreements/agreement-registry/sage2022sanlic/,SAGE Publishing,sage2022sanlic,SAGE Premier Agreement,No,,01/01/2022,12/31/2024,SANLiC,South Africa,327,Average annual corresponding author publications over six years (2014-2019),Agreement costs within the range of the previous spending level,Small annual increases in line with previous increases under the read-only agreements in previous years,Subscriptions partly converted to OA publishing fees,Agreement allows unlimited hybrid OA publishing in SAGE Premier journals. Gold OA publishing is not included but has a minimum 20% discount on APCs.,Yes,No,"CC-BY preference, exceptions allowed","Original research articles, Review articles, Brief communications, Short Reports, Case Reports",20%-50%,,Yes,Yes,Too early to assess,,Agreement will assist in the transition to open access. It is too soon to tell which elements and/or mechanisms will need to be adjusted in the future.
https://esac-initiative.org/about/transformative-agreements/agreement-registry/oxf2023sanlic/,Oxford University Press,oxf2023sanlic,"OUP Consortium Subscription, Perpetual Access and Publishing Agreement",No,,01/01/2023,12/31/2025,SANLiC,South Africa,174,Average publications across 8 years,Agreement costs within the range of the previous spending level,"Consortium members allowed to choose whether to include the “new journal joiners” (NJJs) in their subscription or not. If NJJs included, increases are 8%; 7%, 6% for 2023, 2024, 2025 respectively; if not included, increase is fixed 2% p.a.",Subscriptions fully converted to OA publishing fees (access related costs 5% or less),Minimal risk; uncapped publishing in hybrid journals and discount offered on APCs for gold OA journals,Yes,Yes,CC-BY variations allowed,"Original research articles, Review articles",20%-50%,No distinction is made in the costs between access and publishing costs,Yes,Yes,Too early to assess,,This agreement allows read access to the full 2023 collection for all participants (irrespective of whether they choose to include new journal joiners or not) and uncapped open access publishing of articles in hybrid titles. Discounted APCs are still payable on articles published in fully open access titles.
https://esac-initiative.org/about/transformative-agreements/agreement-registry/eme2022sanlic/,Emerald Publishing,eme2022sanlic,Emerald Agreement,No,,01/01/2022,12/31/2024,SANLiC,South Africa,180,The fixed OA entitlement per year might be exceeded,Cost increase,Cost based on previous year’s subscriptions with nominal increase per year to cover cost of APCs,Subscriptions partly converted to OA publishing fees,APC vouchers are capped and can only be used in the titles to which a member subscribes,Yes,No,"CC-BY preference, exceptions allowed","Original research articles, Review articles",20%-50%,,Yes,Yes,Too early to assess,,"Agreement based on current member subscriptions with a set number of APC vouchers included per year. APCs can only be used in titles to which the member subscribes. The number of vouchers may be insufficient to cover all article output. Although Emerald offered 100% open access, it would have been too expensive for most members."
https://esac-initiative.org/about/transformative-agreements/agreement-registry/acm2021sanlic/,Association for Computing Machinery,acm2021sanlic,ACM Open,No,,01/01/2021,12/31/2023,SANLiC,South Africa,64,,Cost decrease,A decrease in cost for 14 out of 15 subscribing institutions (Tiers 8 – 10),"A transformative, publish and read offer. ACM intend achieving full Open Access within five years.",Uncapped OA publishing,Yes,Yes,CC-BY variations allowed,"Original research articles, Review articles, Proceedings, Letters, Editorials",0%,,Yes,Yes,Too early to assess,,
https://esac-initiative.org/about/transformative-agreements/agreement-registry/els2023sanlic/,Elsevier,els2023sanlic,Elsevier Read and Publish Agreement 2023-2025,No,,01/01/2023,12/31/2025,SANLiC,South Africa,2580,Average Freedom Collection publications (2019-2021) for members,Agreement costs within the range of the previous spending level,Based on prior reading spend with small annual increase,Subscriptions partly converted to OA publishing fees,Capped agreement with no additional expenditure above typical price increases for read-only subscription agreement. Cap is 10% higher than anticipated publication output. The only risk is if the agreement publishes less than the cap allocation (missed opportunity).,Yes,Yes,CC-BY variations allowed,"Original research articles, Review articles, Short communication",20%-50%,Value of article cap is 60% of the total fee,Yes,Partly (e.g. to core journals only),Too early to assess,,"The impact is massive as our largest agreement as it could potentially convert 17% of our research output to OA. Also includes a discount on fully OA APCs. It is more sustainable than the prior read only agreement but must be transitional. 100% APC discount on articles published in fully OA journals. In addition, our cost of reading must diminish and eventually fall away."
https://esac-initiative.org/about/transformative-agreements/agreement-registry/cam2021sanlic/,Cambridge University Press,cam2021sanlic,Cambridge Journals Full Package,No,,01/01/2021,12/31/2024,SANLiC,South Africa,98,Average for 2015-2019 applied,Agreement costs within the range of the previous spending level,Read and publish deal – no extra cost for OA publishing rights in hybrid and gold OA Gold journals in the Premium Full collection. Unlimited access to the Cambridge University Press Premium Full collection. Perpetual access rights for years of subscription.,Subscriptions fully converted to OA publishing fees (access related costs 5% or less),Not applicable,No,Yes,"CC-BY preference, exceptions allowed","Original research articles, Review articles, Brief Reports and Case Reports also included – 3RBC",More than 50%,Publishing costs approximately 9% of total,Yes,Yes,Too early to assess,,
https://esac-initiative.org/about/transformative-agreements/agreement-registry/wiley2022slov/,Wiley,wiley2022slov,Wiley Read and Publish Agreement,No,,01/01/2022,12/31/2024,Slovenian Consortium CTK,Slovenia,130,The average annual article output is expected to be fully covered by the agreement,Cost increase,Cost increase but “within the limits” of overall R & P spending level (total cost of publication),Subscriptions partly converted to OA publishing fees,"If the Article Entitlement is exceeded in any year, then the author-pays route with an APC discount will apply. The agreement does not include refunds for unused articles and does not allow for a roll over to the following year.",Yes,No,CC-BY variations allowed,"Original research articles, Review articles, Case Study, Commentary, Data Article, Education, Lecture, Method and Protocol, Perspective, Practice and Policy, Rapid Publication, Short Communication,",0%,Costs are not split between access and publishing part,Yes,Yes,Too early to assess,After a few workshops and a few articles already being accepted/approved our first impressions are very good!,We consider this agreement sustainable with regards to overall costs and reduced workflow for the authors
https://esac-initiative.org/about/transformative-agreements/agreement-registry/acs2023sanlic/,American Chemical Society,acs2023sanlic,ACS Online Products Agreement,No,,01/01/2023,12/31/2025,SANLiC,South Africa,96,Unlimited publishing in hybrid journals; flat APC rate of US$3000 in ACS Au journals except for ACS Omega (APCs already discounted),Agreement costs within the range of the previous spending level,Increase of 3% per annum for each of the three years of the agreement,Subscriptions partly converted to OA publishing fees,No fixed entitlements; all articles are eligible for OA publication,Yes,Yes,"CC-BY preference, exceptions allowed","Original research articles, Review articles",20%-50%,,Yes,Yes,Too early to assess,To be assessed during the period of the agreement,This agreement has the potential to create a sustainable transition from the previous subscription model to a more inclusive model supporting OA publication by authors affiliated to subscribing SANLiC members
https://esac-initiative.org/about/transformative-agreements/agreement-registry/degruy2022unilj/,Walter De Gruyter,degruy2022unilj,,No,,01/01/2022,12/31/2022,University of Ljubljana,Slovenia,10,,Agreement costs within the range of the previous spending level,,License fee includes open access publishing,,No,No,CC-BY variations allowed,"Original research articles, Review articles, Proceedings, Letters, Editorials",More than 50%,,Yes,Yes,Ok,,
https://esac-initiative.org/about/transformative-agreements/agreement-registry/degruy2023cosec/,Walter De Gruyter,degruy2023cosec,,No,,01/01/2023,12/31/2023,COSEC Consortium,Slovenia,20,,Cost increase,Cost increase because more institutions joined the consortium,License fee includes open access publishing,,No,No,CC-BY variations allowed,"Original research articles, Review articles, Proceedings, Letters, Editorials",More than 50%,,Yes,Yes,Ok,,
